<?xml version="1.0" encoding="utf-8"?>
<savedGames xsi:schemaLocation="http://www.univ-grenoble-alpes.fr/l3miage/jeu_video ../xsd/savedGames.xsd" xmlns="http://www.univ-grenoble-alpes.fr/l3miage/jeu_video" xmlns:xsi="http://www.w3.org/2001/XMLSchema-instance">
  <parties>
    <partie>
      <nomjoueur>John Doe</nomjoueur>
      <date>2024-12-16</date>
      <score>1200</score>
    </partie>
    <partie>
      <nomjoueur>John Rami</nomjoueur>
      <date>2024-11-15</date>
      <score>1400</score>
    </partie>
    <partie>
      <nomjoueur>John Doe</nomjoueur>
      <date>2024-12-15</date>
      <score>700</score>
    </partie>
    <partie>
      <nomjoueur>John Doe</nomjoueur>
      <date>2021-12-15</date>
      <score>140</score>
    </partie>
  </parties>
</savedGames>