<?xml version="1.0" encoding="UTF-8"?>
<savedGames xmlns="http://www.univ-grenoble-alpes.fr/l3miage/jeu_video" 
            xmlns:xsi="http://www.w3.org/2001/XMLSchema-instance"
            xsi:schemaLocation="http://www.univ-grenoble-alpes.fr/l3miage/profile ../xsd/savedGames.xsd">
    
    <parties>
        <partie>
            <nomjoueur>John Doe</nomjoueur>
            <date>2024-12-16</date>
            <score>1200</score>
        </partie>
        
        <partie>
            <nomjoueur>John Rami</nomjoueur>
            <date>2024-11-15</date>
            <score>1400</score>
        </partie>

        <partie>
            <nomjoueur>John Doe</nomjoueur>
            <date>2024-12-15</date>
            <score>700</score>
        </partie>

        <partie>
            <nomjoueur>Reina la reine</nomjoueur>
            <date>2024-11-15</date>
            <score>1400</score>
        </partie>

        <partie>
            <nomjoueur>John Doe</nomjoueur>
            <date>2021-12-15</date>
            <score>140</score>
        </partie>

        <partie>
            <nomjoueur>Dorian</nomjoueur>
            <date>2018-12-15</date>
            <score>10</score>
        </partie>

        <partie>
            <nomjoueur>Marianne</nomjoueur>
            <date>2020-12-15</date>
            <score>340</score>
        </partie>
        

        <partie>
            <nomjoueur>Reina la reine</nomjoueur>
            <date>2019-07-15</date>
            <score>140</score>
        </partie>
        
    </parties>
    
</savedGames>